{
  "version": "1.0.7.0",
  "metadata": {
    "title": "uDOS Example World",
    "author": "uDOS Team",
    "created": "2026-01-18T00:00:00Z",
    "updated": "2026-01-18T00:00:00Z",
    "description": "Small example world for testing grid runtime with v1.0.7.0 schema"
  },
  "locations": [
    {
      "id": "L300-AA10",
      "name": "Garden Entrance",
      "kind": "poi",
      "layer": 300,
      "cell": "AA10",
      "terrain": "grass",
      "description": "You stand at the entrance to a lush garden. Paths lead in all directions.",
      "objects": [
        {
          "id": "gate_entrance",
          "name": "Garden Gate",
          "character": "|",
          "kind": "door"
        }
      ],
      "sprites": [],
      "markers": [
        {
          "id": "start_marker",
          "character": "â˜…",
          "kind": "waypoint"
        }
      ],
      "connections": {
        "N": "L300-AA11",
        "E": "L300-AB10",
        "S": "L300-AA09",
        "W": "L300-ZZ10"
      },
      "metadata": {
        "visited": true,
        "discovered_at": "2026-01-18T10:30:00Z"
      }
    },
    {
      "id": "L300-AB10",
      "name": "Town Square",
      "kind": "landmark",
      "layer": 300,
      "cell": "AB10",
      "terrain": "stone",
      "population": 500,
      "description": "The bustling heart of the town. A fountain sits at the center with merchants and townsfolk milling about.",
      "objects": [
        {
          "id": "fountain",
          "name": "Stone Fountain",
          "character": "â‰ˆ",
          "kind": "statue"
        },
        {
          "id": "market_stall_1",
          "name": "Market Stall",
          "character": "â–¬",
          "kind": "door"
        }
      ],
      "sprites": [
        {
          "id": "merchant_mara",
          "name": "Mara the Merchant",
          "character": "M",
          "kind": "merchant",
          "z": 5
        },
        {
          "id": "guard_1",
          "name": "Gate Guard",
          "character": "G",
          "kind": "guard",
          "z": 5
        }
      ],
      "markers": [
        {
          "id": "quest_marker_1",
          "character": "!",
          "kind": "quest"
        }
      ],
      "connections": {
        "N": "L300-AB11",
        "E": "L300-AC10",
        "S": "L300-AB09",
        "W": "L300-AA10"
      },
      "metadata": {
        "safe_zone": true,
        "market_active": true
      }
    },
    {
      "id": "L300-AC10",
      "name": "Dark Forest",
      "kind": "forest",
      "layer": 300,
      "cell": "AC10",
      "terrain": "forest",
      "description": "Ancient trees tower overhead, their branches blocking out most of the light. Strange sounds echo through the undergrowth.",
      "objects": [
        {
          "id": "ancient_tree",
          "name": "Ancient Oak",
          "character": "ðŸŒ³",
          "kind": "tree"
        }
      ],
      "sprites": [
        {
          "id": "wild_wolf",
          "name": "Dire Wolf",
          "character": "W",
          "kind": "creature",
          "z": 5
        }
      ],
      "markers": [
        {
          "id": "danger_marker",
          "character": "âš ",
          "kind": "danger"
        }
      ],
      "connections": {
        "N": "L300-AC11",
        "E": "L300-AD10",
        "S": "L300-AC09",
        "W": "L300-AB10"
      },
      "metadata": {
        "hostile_creatures": true,
        "light_level": 0.3
      }
    },
    {
      "id": "L300-AA09",
      "name": "Underground Cavern",
      "kind": "cave",
      "layer": 300,
      "cell": "AA09",
      "terrain": "stone",
      "elevation_m": -50,
      "description": "A dark cavern stretches before you, lit by glowing crystals embedded in the walls. The air is cool and damp.",
      "objects": [
        {
          "id": "crystal_formation",
          "name": "Glowing Crystals",
          "character": "*",
          "kind": "statue"
        },
        {
          "id": "treasure_chest",
          "name": "Wooden Chest",
          "character": "â—Š",
          "kind": "chest"
        }
      ],
      "sprites": [],
      "markers": [
        {
          "id": "treasure_marker",
          "character": "X",
          "kind": "treasure"
        }
      ],
      "connections": {
        "N": "L300-AA10",
        "E": "L300-AB09",
        "S": "L300-AA08",
        "W": "L300-ZZ09"
      },
      "metadata": {
        "treasure": true,
        "light_level": 0.5
      }
    }
  ],
  "terrain_types": [
    {
      "id": "grass",
      "name": "Grass",
      "character": ".",
      "teletext_block": "â–‘",
      "color": "green",
      "traversable": true
    },
    {
      "id": "stone",
      "name": "Stone",
      "character": "#",
      "teletext_block": "â–“",
      "color": "white",
      "traversable": true
    },
    {
      "id": "water",
      "name": "Water",
      "character": "~",
      "teletext_block": "â–’",
      "color": "blue",
      "traversable": false
    },
    {
      "id": "forest",
      "name": "Forest",
      "character": "t",
      "teletext_block": "â–ˆ",
      "color": "green",
      "traversable": true
    },
    {
      "id": "mountain",
      "name": "Mountain",
      "character": "^",
      "teletext_block": "â–²",
      "color": "white",
      "traversable": false
    }
  ]
}
